{"authority_id":"dpgen-release-source-docs-0-13-3","blockers":[{"code":"doc.body.bytes.external","description":"Official documentation bodies and per-page hashes are external, so provider-required subjects remain blocked."}],"contract_name":"official-corpus-manifest","corpus_id":"deepmd-rigorous-workflows-dpgen-docs-official-corpus","discovery":{"authority_revision":"0.13.3","authority_root":"https://github.com/deepmodeling/dpgen/tree/","discovered_source_ids":["dpgen-exact-document-tree-inventory"],"enumerator":{"attestation_id":null,"configuration_ref":{"path":"contracts/official-document-pack-seed.schema.json","sha256":"82d86a53e420836161b1fe901736d83315c7e265c42f7771e5d8bd8ce9785599"},"dependency_lock_ref":{"path":"contracts/official-document-pack-builder-lock.json","sha256":"48e28868dc2fefaa8ce9631654f01082493c0321bead6be4fbcbc072b4c3d8a9"},"enumerator_id":"official-document-pack-enumerator","enumerator_version":"1.0","implementation_ref":{"path":"tools/build_official_document_packs.py","sha256":"a2c15fc1d2b4c3266544b9a7e64c6f443799f27e87ee12d64a94fb43ea4cf936"},"input_sha256":"9d7a45f7fae524f3b9c5724218dd3f8d608e36844ab8e89edb2a93075e986a59","output_sha256":"4e12b1cd393eac884b67fe9468a6c34142971c643930876fc097657b6aad82bc","trust_mode":"central-pinned"},"inventory_format":"declarative-source-catalog-v1","inventory_locator":"skills/deepmd-rigorous-workflows/references/source-pack-source-catalog-dpgen.json","inventory_receipt":null,"inventory_scope":"bounded-authority-subset","inventory_sha256":"9d7a45f7fae524f3b9c5724218dd3f8d608e36844ab8e89edb2a93075e986a59","inventory_storage_mode":"embedded-open","method":"manual-inventory","upstream_universe_complete":false},"included_sources":[{"identity":{"kind":"revision","raw_bytes":20700,"raw_sha256":"7713a78d0a64cf7118945f9a6feb43c459d8dba56e4662c1ff83c78a855fb41f","resolver_receipt":{"canonical_url":"https://github.com/deepmodeling/dpgen/tree/v0.13.3","evidence_sha256":"04e6db53d6afa2945ca41cbf8eaac5e5c4d1eb9854b9fdfc3e87ab32ce358d7a","raw_bytes":20700,"raw_sha256":"7713a78d0a64cf7118945f9a6feb43c459d8dba56e4662c1ff83c78a855fb41f","receipt_id":"deepmd-rigorous-workflows-dpgen-docs-dpgen-exact-document-tree-inventory-source-receipt","registry_path":"registry/official-document-consumers.yaml","registry_sha256":"60bf8d0f3d9596eeac1d9541d5f819d549ac937ab5a6fa5c316f6413d939a99c","resolver_id":"official-document-pack-builder","retrieved_utc":"2026-07-23T20:17:38Z","selected_bytes":20700,"selected_sha256":"7713a78d0a64cf7118945f9a6feb43c459d8dba56e4662c1ff83c78a855fb41f","selection_attestation_id":null,"trust_id":null,"trust_mode":"unverified","verification_status":"unverified"},"value":"commit:66232e5f05f90d6e399b1c25fd0d914ea3e40af8;root-tree:8d66ef30f286a1825533bd4a2f1e941886f85290"},"locator":"https://github.com/deepmodeling/dpgen/tree/v0.13.3","source_id":"dpgen-exact-document-tree-inventory","source_kind":"index","version_scope":{"kind":"exact","retrieved_utc":null,"snapshot_identity":null,"value":"0.13.3"}}],"limitations":["Central processor hashes are pinned, but this exact input/output run has no platform attestation.","Exact release documentation and example tree metadata are retained without bodies or executable/serialized artifacts.","External raw identity is the SHA-256 of canonical sorted git ls-tree -r receipt lines '<mode> <object_type> <object_id>\\t<path>\\n' for every inventory entry; the local inventory JSON is metadata evidence only and contains no official document body bytes.","This exact metadata inventory does not establish dependency compatibility, native CLI behavior, backend equivalence, model validity, or scientific acceptance."],"producer":{"generated_utc":"2026-07-23T20:17:38Z","skill_id":"deepmd-rigorous-workflows","skill_version":"1.0","tool_id":"official-document-pack-builder","tool_version":"1.0"},"provider_id":"dpgen","reviewed_exclusions":[],"schema_version":"1.0","status":"blocked","version_scope":{"kind":"exact","retrieved_utc":null,"snapshot_identity":null,"value":"0.13.3"}}
