{"authority_id":"vesta-official-manual","blockers":[],"contract_name":"official-corpus-manifest","corpus_id":"dft-postprocess-vesta-manual-official-corpus","discovery":{"authority_revision":"95df403269547e78da4b602e33ef8f9c79758319e1373395789332f15c56f421","authority_root":"https://jp-minerals.org/vesta/en/doc/","discovered_source_ids":["vesta-command-line"],"enumerator":{"attestation_id":null,"configuration_ref":{"path":"contracts/official-document-pack-seed.schema.json","sha256":"82d86a53e420836161b1fe901736d83315c7e265c42f7771e5d8bd8ce9785599"},"dependency_lock_ref":{"path":"contracts/official-document-pack-builder-lock.json","sha256":"48e28868dc2fefaa8ce9631654f01082493c0321bead6be4fbcbc072b4c3d8a9"},"enumerator_id":"official-document-pack-enumerator","enumerator_version":"1.0","implementation_ref":{"path":"tools/build_official_document_packs.py","sha256":"a2c15fc1d2b4c3266544b9a7e64c6f443799f27e87ee12d64a94fb43ea4cf936"},"input_sha256":"14cef380c592e74a2b6a1ae0070bb65dd9efa5d20305d40d511be9fdf5e1a9da","output_sha256":"792122f7c76027306d8dae5a77fbec97a2a909ecdb016e2b6e092e792ac58d62","trust_mode":"central-pinned"},"inventory_format":"declarative-source-catalog-v1","inventory_locator":"skills/dft-postprocess/references/source-pack-inputs/vesta-manual.json","inventory_receipt":null,"inventory_scope":"bounded-authority-subset","inventory_sha256":"14cef380c592e74a2b6a1ae0070bb65dd9efa5d20305d40d511be9fdf5e1a9da","inventory_storage_mode":"embedded-open","method":"manual-inventory","upstream_universe_complete":false},"included_sources":[{"identity":{"kind":"external-receipt","raw_bytes":12093,"raw_sha256":"9ccdb26b2c7927b48f24d217d17d59b8b8043db09cb713ace96e8a863fca57df","resolver_receipt":{"canonical_url":"https://jp-minerals.org/vesta/en/doc/VESTAch17.html","evidence_sha256":"14cef380c592e74a2b6a1ae0070bb65dd9efa5d20305d40d511be9fdf5e1a9da","raw_bytes":12093,"raw_sha256":"9ccdb26b2c7927b48f24d217d17d59b8b8043db09cb713ace96e8a863fca57df","receipt_id":"dft-postprocess-vesta-manual-vesta-command-line-source-receipt","registry_path":"registry/official-document-consumers.yaml","registry_sha256":"60bf8d0f3d9596eeac1d9541d5f819d549ac937ab5a6fa5c316f6413d939a99c","resolver_id":"official-document-pack-builder","retrieved_utc":"2026-07-24T00:00:00Z","selected_bytes":12093,"selected_sha256":"9ccdb26b2c7927b48f24d217d17d59b8b8043db09cb713ace96e8a863fca57df","selection_attestation_id":null,"trust_id":null,"trust_mode":"unverified","verification_status":"unverified"},"value":"dft-postprocess-vesta-manual-vesta-command-line-source-receipt"},"locator":"https://jp-minerals.org/vesta/en/doc/VESTAch17.html","source_id":"vesta-command-line","source_kind":"manual-page","version_scope":{"kind":"latest-at-retrieval","retrieved_utc":"2026-07-24T00:00:00Z","snapshot_identity":{"content_sha256":"9ccdb26b2c7927b48f24d217d17d59b8b8043db09cb713ace96e8a863fca57df","kind":"sha256","value":"9ccdb26b2c7927b48f24d217d17d59b8b8043db09cb713ace96e8a863fca57df"},"value":null}}],"limitations":["Central processor hashes are pinned, but this exact input/output run has no platform attestation.","Route maturity is copied exactly from the canonical observable registry and is never raised.","The pack stores metadata and receipts only and does not embed provider text.","The rolling manual is not bound to an exact installed VESTA executable."],"producer":{"generated_utc":"2026-07-24T00:00:00Z","skill_id":"dft-postprocess","skill_version":"1.0","tool_id":"official-document-pack-builder","tool_version":"1.0"},"provider_id":"vesta","reviewed_exclusions":[],"schema_version":"1.0","status":"partial","version_scope":{"kind":"latest-at-retrieval","retrieved_utc":"2026-07-24T00:00:00Z","snapshot_identity":{"content_sha256":"95df403269547e78da4b602e33ef8f9c79758319e1373395789332f15c56f421","kind":"sha256","value":"95df403269547e78da4b602e33ef8f9c79758319e1373395789332f15c56f421"},"value":null}}
