{"authority_id":"ase-release-source-docs-3-29-0","blockers":[],"contract_name":"official-corpus-manifest","corpus_id":"dft-postprocess-ase-3-29-postprocess-official-corpus","discovery":{"authority_revision":"3.29.0","authority_root":"https://gitlab.com/ase/ase/-/raw/f27c0005ae6a67ea419f996e728668865bfc1f86/doc/ase/","discovered_source_ids":["ase-io-doc"],"enumerator":{"attestation_id":null,"configuration_ref":{"path":"contracts/official-document-pack-seed.schema.json","sha256":"82d86a53e420836161b1fe901736d83315c7e265c42f7771e5d8bd8ce9785599"},"dependency_lock_ref":{"path":"contracts/official-document-pack-builder-lock.json","sha256":"48e28868dc2fefaa8ce9631654f01082493c0321bead6be4fbcbc072b4c3d8a9"},"enumerator_id":"official-document-pack-enumerator","enumerator_version":"1.0","implementation_ref":{"path":"tools/build_official_document_packs.py","sha256":"a2c15fc1d2b4c3266544b9a7e64c6f443799f27e87ee12d64a94fb43ea4cf936"},"input_sha256":"a4866bbebdf819bf23f790751d33330e29cdeceacd532ade1dda632988cca40c","output_sha256":"21d7d2211eeb4f08fb09d05b3163144163c9d56b5a360799cd089c54ce82ee43","trust_mode":"central-pinned"},"inventory_format":"declarative-source-catalog-v1","inventory_locator":"skills/dft-postprocess/references/source-pack-inputs/ase-3-29-postprocess.json","inventory_receipt":null,"inventory_scope":"bounded-authority-subset","inventory_sha256":"a4866bbebdf819bf23f790751d33330e29cdeceacd532ade1dda632988cca40c","inventory_storage_mode":"embedded-open","method":"manual-inventory","upstream_universe_complete":false},"included_sources":[{"identity":{"kind":"revision","raw_bytes":5187,"raw_sha256":"f9ff991bae9525683fefafa704205de934a88c3399d9912ae64bc26e930f2078","resolver_receipt":{"canonical_url":"https://gitlab.com/ase/ase/-/raw/f27c0005ae6a67ea419f996e728668865bfc1f86/doc/ase/io/io.rst","evidence_sha256":"a4866bbebdf819bf23f790751d33330e29cdeceacd532ade1dda632988cca40c","raw_bytes":5187,"raw_sha256":"f9ff991bae9525683fefafa704205de934a88c3399d9912ae64bc26e930f2078","receipt_id":"dft-postprocess-ase-3-29-postprocess-ase-io-doc-source-receipt","registry_path":"registry/official-document-consumers.yaml","registry_sha256":"60bf8d0f3d9596eeac1d9541d5f819d549ac937ab5a6fa5c316f6413d939a99c","resolver_id":"official-document-pack-builder","retrieved_utc":"2026-07-24T00:00:00Z","selected_bytes":5187,"selected_sha256":"f9ff991bae9525683fefafa704205de934a88c3399d9912ae64bc26e930f2078","selection_attestation_id":null,"trust_id":null,"trust_mode":"unverified","verification_status":"unverified"},"value":"f27c0005ae6a67ea419f996e728668865bfc1f86"},"locator":"https://gitlab.com/ase/ase/-/raw/f27c0005ae6a67ea419f996e728668865bfc1f86/doc/ase/io/io.rst","source_id":"ase-io-doc","source_kind":"source-documentation","version_scope":{"kind":"exact","retrieved_utc":null,"snapshot_identity":null,"value":"3.29.0"}}],"limitations":["Central processor hashes are pinned, but this exact input/output run has no platform attestation.","Only the ASE surface directly consumed by structure views is selected.","Route maturity is copied exactly from the canonical observable registry and is never raised.","The pack stores metadata and receipts only and does not embed provider text."],"producer":{"generated_utc":"2026-07-24T00:00:00Z","skill_id":"dft-postprocess","skill_version":"1.0","tool_id":"official-document-pack-builder","tool_version":"1.0"},"provider_id":"ase","reviewed_exclusions":[],"schema_version":"1.0","status":"partial","version_scope":{"kind":"exact","retrieved_utc":null,"snapshot_identity":null,"value":"3.29.0"}}
