{"authority_id":"gemmi-0-7-5-source-docs","blockers":[],"contract_name":"official-corpus-manifest","corpus_id":"cif-structure-analysis-gemmi-0-7-5-official-corpus","discovery":{"authority_revision":"0.7.5","authority_root":"https://raw.githubusercontent.com/project-gemmi/gemmi/5cc1c23c6007e0e6cbd69289c6f7c0bff50e943e/docs/","discovered_source_ids":["gemmi-cif-doc"],"enumerator":{"attestation_id":null,"configuration_ref":{"path":"contracts/official-document-pack-seed.schema.json","sha256":"82d86a53e420836161b1fe901736d83315c7e265c42f7771e5d8bd8ce9785599"},"dependency_lock_ref":{"path":"contracts/official-document-pack-builder-lock.json","sha256":"48e28868dc2fefaa8ce9631654f01082493c0321bead6be4fbcbc072b4c3d8a9"},"enumerator_id":"official-document-pack-enumerator","enumerator_version":"1.0","implementation_ref":{"path":"tools/build_official_document_packs.py","sha256":"a2c15fc1d2b4c3266544b9a7e64c6f443799f27e87ee12d64a94fb43ea4cf936"},"input_sha256":"2fbf0f37b3f39ec3cb890a5b2d898a70451b7458922c027876205e2335f5cf43","output_sha256":"865aa4dd6ec19a4be8248ebc5562ca355e2fb6072acef4916a9643a83a7e2fd0","trust_mode":"central-pinned"},"inventory_format":"declarative-source-catalog-v1","inventory_locator":"skills/cif-structure-analysis/references/source-pack-inputs/gemmi-0-7-5.json","inventory_receipt":null,"inventory_scope":"bounded-authority-subset","inventory_sha256":"2fbf0f37b3f39ec3cb890a5b2d898a70451b7458922c027876205e2335f5cf43","inventory_storage_mode":"embedded-open","method":"manual-inventory","upstream_universe_complete":false},"included_sources":[{"identity":{"kind":"revision","raw_bytes":84699,"raw_sha256":"4f55da8227e66d3e2f8c1cc3a52324ccf6b5eb335c80159e330023894f1ebdd2","resolver_receipt":{"canonical_url":"https://raw.githubusercontent.com/project-gemmi/gemmi/5cc1c23c6007e0e6cbd69289c6f7c0bff50e943e/docs/cif.rst","evidence_sha256":"2fbf0f37b3f39ec3cb890a5b2d898a70451b7458922c027876205e2335f5cf43","raw_bytes":84699,"raw_sha256":"4f55da8227e66d3e2f8c1cc3a52324ccf6b5eb335c80159e330023894f1ebdd2","receipt_id":"cif-structure-analysis-gemmi-0-7-5-gemmi-cif-doc-source-receipt","registry_path":"registry/official-document-consumers.yaml","registry_sha256":"60bf8d0f3d9596eeac1d9541d5f819d549ac937ab5a6fa5c316f6413d939a99c","resolver_id":"official-document-pack-builder","retrieved_utc":"2026-07-24T00:00:00Z","selected_bytes":84699,"selected_sha256":"4f55da8227e66d3e2f8c1cc3a52324ccf6b5eb335c80159e330023894f1ebdd2","selection_attestation_id":null,"trust_id":null,"trust_mode":"unverified","verification_status":"unverified"},"value":"5cc1c23c6007e0e6cbd69289c6f7c0bff50e943e"},"locator":"https://raw.githubusercontent.com/project-gemmi/gemmi/5cc1c23c6007e0e6cbd69289c6f7c0bff50e943e/docs/cif.rst","source_id":"gemmi-cif-doc","source_kind":"source-documentation","version_scope":{"kind":"exact","retrieved_utc":null,"snapshot_identity":null,"value":"0.7.5"}}],"limitations":["Central processor hashes are pinned, but this exact input/output run has no platform attestation.","Gemmi documents CIF2 and DDLm as unsupported; those inputs are routed elsewhere.","IUCr dictionary licensing and full portal enumeration remain unresolved.","Open-ended dependency ranges are not equivalent to these exact provider snapshots.","The pack is metadata-only and does not embed official documentation text."],"producer":{"generated_utc":"2026-07-24T00:00:00Z","skill_id":"cif-structure-analysis","skill_version":"1.0","tool_id":"official-document-pack-builder","tool_version":"1.0"},"provider_id":"gemmi","reviewed_exclusions":[],"schema_version":"1.0","status":"partial","version_scope":{"kind":"exact","retrieved_utc":null,"snapshot_identity":null,"value":"0.7.5"}}
