{"authority_id":"spglib-release-source-docs-2-7-0","blockers":[],"contract_name":"official-corpus-manifest","corpus_id":"cif-structure-analysis-spglib-2-7-0-official-corpus","discovery":{"authority_revision":"2.7.0","authority_root":"https://github.com/spglib/spglib/12355c77fb7c505a55f52cae36341d73b781a065/docs/","discovered_source_ids":["spglib-api","spglib-python-interface"],"enumerator":{"attestation_id":null,"configuration_ref":{"path":"contracts/official-document-pack-seed.schema.json","sha256":"82d86a53e420836161b1fe901736d83315c7e265c42f7771e5d8bd8ce9785599"},"dependency_lock_ref":{"path":"contracts/official-document-pack-builder-lock.json","sha256":"48e28868dc2fefaa8ce9631654f01082493c0321bead6be4fbcbc072b4c3d8a9"},"enumerator_id":"official-document-pack-enumerator","enumerator_version":"1.0","implementation_ref":{"path":"tools/build_official_document_packs.py","sha256":"a2c15fc1d2b4c3266544b9a7e64c6f443799f27e87ee12d64a94fb43ea4cf936"},"input_sha256":"691ba8bdd0fc02dd6078a62736fd71680c69535b005007301c56a7c4d1e6a368","output_sha256":"6e8c9e60db5ce3ebc6683b7d22f229f14ea190bfe685612786c51bda655d5c02","trust_mode":"central-pinned"},"inventory_format":"declarative-source-catalog-v1","inventory_locator":"skills/cif-structure-analysis/references/source-pack-inputs/spglib-2-7-0.json","inventory_receipt":null,"inventory_scope":"bounded-authority-subset","inventory_sha256":"691ba8bdd0fc02dd6078a62736fd71680c69535b005007301c56a7c4d1e6a368","inventory_storage_mode":"embedded-open","method":"manual-inventory","upstream_universe_complete":false},"included_sources":[{"identity":{"kind":"revision","raw_bytes":8995,"raw_sha256":"0d374f692d3afc212e685a612d2dc715942b80fa315e530cd42f6c851bd85807","resolver_receipt":{"canonical_url":"https://raw.githubusercontent.com/spglib/spglib/12355c77fb7c505a55f52cae36341d73b781a065/docs/python-interface.md","evidence_sha256":"691ba8bdd0fc02dd6078a62736fd71680c69535b005007301c56a7c4d1e6a368","raw_bytes":8995,"raw_sha256":"0d374f692d3afc212e685a612d2dc715942b80fa315e530cd42f6c851bd85807","receipt_id":"cif-structure-analysis-spglib-2-7-0-spglib-python-interface-source-receipt","registry_path":"registry/official-document-consumers.yaml","registry_sha256":"60bf8d0f3d9596eeac1d9541d5f819d549ac937ab5a6fa5c316f6413d939a99c","resolver_id":"official-document-pack-builder","retrieved_utc":"2026-07-24T00:00:00Z","selected_bytes":8995,"selected_sha256":"0d374f692d3afc212e685a612d2dc715942b80fa315e530cd42f6c851bd85807","selection_attestation_id":null,"trust_id":null,"trust_mode":"unverified","verification_status":"unverified"},"value":"12355c77fb7c505a55f52cae36341d73b781a065"},"locator":"https://raw.githubusercontent.com/spglib/spglib/12355c77fb7c505a55f52cae36341d73b781a065/docs/python-interface.md","source_id":"spglib-python-interface","source_kind":"source-documentation","version_scope":{"kind":"exact","retrieved_utc":null,"snapshot_identity":null,"value":"2.7.0"}},{"identity":{"kind":"revision","raw_bytes":25567,"raw_sha256":"47f5f6d07eb221b1309ac7b8daebbeae50ad6137cf5594ceb87c953b1b47255b","resolver_receipt":{"canonical_url":"https://raw.githubusercontent.com/spglib/spglib/12355c77fb7c505a55f52cae36341d73b781a065/docs/api.md","evidence_sha256":"691ba8bdd0fc02dd6078a62736fd71680c69535b005007301c56a7c4d1e6a368","raw_bytes":25567,"raw_sha256":"47f5f6d07eb221b1309ac7b8daebbeae50ad6137cf5594ceb87c953b1b47255b","receipt_id":"cif-structure-analysis-spglib-2-7-0-spglib-api-source-receipt","registry_path":"registry/official-document-consumers.yaml","registry_sha256":"60bf8d0f3d9596eeac1d9541d5f819d549ac937ab5a6fa5c316f6413d939a99c","resolver_id":"official-document-pack-builder","retrieved_utc":"2026-07-24T00:00:00Z","selected_bytes":25567,"selected_sha256":"47f5f6d07eb221b1309ac7b8daebbeae50ad6137cf5594ceb87c953b1b47255b","selection_attestation_id":null,"trust_id":null,"trust_mode":"unverified","verification_status":"unverified"},"value":"12355c77fb7c505a55f52cae36341d73b781a065"},"locator":"https://raw.githubusercontent.com/spglib/spglib/12355c77fb7c505a55f52cae36341d73b781a065/docs/api.md","source_id":"spglib-api","source_kind":"source-documentation","version_scope":{"kind":"exact","retrieved_utc":null,"snapshot_identity":null,"value":"2.7.0"}}],"limitations":["Central processor hashes are pinned, but this exact input/output run has no platform attestation.","IUCr dictionary licensing and full portal enumeration remain unresolved.","Open-ended dependency ranges are not equivalent to these exact provider snapshots.","The Skill admits spglib versions newer than this exact documentation snapshot.","The pack is metadata-only and does not embed official documentation text."],"producer":{"generated_utc":"2026-07-24T00:00:00Z","skill_id":"cif-structure-analysis","skill_version":"1.0","tool_id":"official-document-pack-builder","tool_version":"1.0"},"provider_id":"spglib","reviewed_exclusions":[],"schema_version":"1.0","status":"partial","version_scope":{"kind":"exact","retrieved_utc":null,"snapshot_identity":null,"value":"2.7.0"}}
